Website,Course,Score,Reasoning
https://manyasoft.com/,Programming,98,"As a software development company focused on cutting-edge technologies like AI, machine learning, and blockchain, continuous upskilling in programming is essential for their core business."
https://www.techasoft.com/,Programming,98,"Techasoft is an IT solutions company whose core business is software, website, and application development, with an extensive list of supported programming languages and technologies."
http://www.asmltd.com/,Programming,98,"The company's core business is providing high-tech engineering, product R&D, and digital services, with job openings for specialized roles like Computer Vision Engineer requiring C++ and OpenCV skills."
https://vraio.in/,Programming,95,"Vraio is a software development company whose core services, mission, and open career positions are all fundamentally centered on technical and programming expertise."
https://www.zinavo.com/,Programming,98,The company is a dedicated web and software development firm whose services are explicitly based on a wide range of programming languages and technologies.
https://www.nextbraintech.com/,Programming,98,"The company is an enterprise software development firm whose entire service offering is based on a vast and diverse technology stack, including AI, web, and mobile programming."
https://www.igeekstechnologies.com/,Programming,95,"The institution is a technology training platform that overwhelmingly offers internships and courses in computer science, data science, and various engineering disciplines."
https://www.zensar.com/,Programming,95,"Zensar is a technology services company with a strong focus on engineering, AI, data analytics, and cloud platforms, indicating a primary need for advanced programming skills to deliver their core offerings."
http://www.microgreentech.com/,Programming,98,"The company's core business is technology consulting, staff augmentation, and application development, making advanced programming skills essential for their workforce."
https://www.pramati.com/,Programming,98,"Pramati is a technology incubator fundamentally focused on creating innovative software products for global markets, employing over 1,400 engineers and fostering a deep culture of technical development."
https://nexential.co.uk/,Programming,95,"The company's core identity is a custom software development firm specializing in advanced technologies like AI, IoT, and Machine Learning, indicating a primary need for advanced programming skills."
http://www.amsantechnology.in/,Programming,95,"The company's primary business is providing cloud hosting and creating customized software modules for TallyPrime, which requires strong technical and programming skills."
http://www.calctechnologies.com/,Programming,95,"The company is a software and technology consulting firm specializing in technical services like Application Development, Artificial Intelligence, and Data & Analytics."
https://www.hackerearth.com/,Programming,100,"The institution is an online platform entirely dedicated to coding assessments, hackathons, and developer skill evaluation for tech hiring."
http://www.elfonze.com/,Programming,95,"The company is a technology services firm specializing in Oracle ERP, custom digital application development, AI platforms, and embedded electronics, all of which require strong programming expertise."
https://www.meridatechminds.com/,Programming,98,"The company is an IT services and solutions provider whose core business of software development, IT consulting, and tech training fundamentally relies on advanced programming expertise."
http://www.effone.com/,Programming,98,"The company is a global IT consulting firm whose core services and job openings are entirely focused on software development, DevOps, and other technical engineering disciplines."
https://www.infosys.com/,Programming,100,"Infosys is a global leader in technology services and consulting whose entire business model is predicated on deep expertise in digital transformation, AI, cloud, and application development."
http://aspironkhuze.com/,Programming,95,"Aspironkhuze is a technology solutions company whose core services are centered on web development, app development, and cloud architecture, indicating a primary need for advanced programming skills."
http://invariatech.com/,Programming,98,"Invaria is a software product development services company whose core offerings, team expertise, and company vision are exclusively centered around technology and engineering."
http://erpbangalore.com/,Programming,95,"The company's core business is custom ERP, CRM, and mobile application development, employing a large team of software engineers, developers, and other IT professionals."
http://www.mindroit.com/,Programming,95,The company is a software and mobile application development firm whose core services and hiring needs are explicitly focused on programming technologies.
http://rupstech.com/,Programming,98,"As a leading technology service provider specializing in end-to-end software application development across numerous advanced fields like AI/ML and cloud computing, their core business is fundamentally reliant on programming expertise."
https://bluerose-tech.com/,Sales,95,"The company is actively hiring for a senior 'Associate Director – Channel Sales' role, indicating a strategic focus on expanding their B2B sales capabilities."
https://www.oracle.com/in/,Programming,98,"Oracle is a premier technology corporation with a core focus on databases, cloud platforms, AI, and dedicated developer resources, making advanced programming skills essential to their business."
https://www.itcinfotech.com/,Programming,98,"As a global technology services and solutions provider, the company's core business is fundamentally built on advanced technical and programming capabilities across cloud, application development, and AI."
http://www.embrightinfotech.com/,Programming,98,The company is a deep-tech startup focused on XR/AI software development and is actively hiring for highly technical roles requiring skills like C# and Unity.
https://www.reckonsys.com/,Programming,98,"The company's core identity and services are centered on custom software development, AI solutions, and a vast array of programming technologies."
http://www.techpearl.com/,Programming,98,"The company is an AWS-focused custom software development firm whose core business, services, and team expertise are entirely centered on programming and engineering."
http://www.testyantra.com/,Programming,98,The company's core business is providing software quality assurance services and training developers and testers in programming languages and automation frameworks.
http://www.chloros.in/,Programming,98,"The company's core business is providing a comprehensive range of technical services, including custom software, web, and mobile application development."
https://www.webcyphertechnologies.com/,Programming,95,"The company name, WebCypher Technologies, strongly indicates a core business focused on software development and technology."
http://www.freshtronics.in/,Programming,95,"The company is a web and app development agency that specializes in numerous programming technologies including Fullstack, WordPress, Shopify, and mobile development."
https://corseltechnologies.com/,Programming,98,"Corsel Technologies is a software development company whose core services and expertise are entirely centered on programming and advanced technologies like AI, blockchain, and app development."
http://isinfotech.in/,Programming,95,"The company's core services are centered on technology, including software development, web applications, and a 'hire, train, and deploy' model, indicating a strong need for programming skills."
https://fugenx.com/,Programming,98,"FuGenX is a technology services company specializing in mobile app development, game development, AI, and Machine Learning, making advanced programming skills essential for their core business."
http://mcrindia.in/,Sales,90,"The company explicitly identifies itself as a 'Leading Sales, Support, customization, Integrator & Extender Partners for Tally Solutions', highlighting sales as a core component of its business model."
http://www.dyutitech.com/,Programming,95,"The company explicitly lists Application Development, Product Development, and quality software services as core offerings, indicating a strong need for technical programming skills."
http://www.wolkensoftware.com/,Programming,95,"As a B2B SaaS company building an AI-powered, low-code enterprise service platform, advanced programming skills are fundamental to their core product development and innovation."
https://www.nichi.com/,Programming,95,"Nichi-In is an IT services and software development company with a core business of providing customized technical solutions, enterprise applications, and AI/ML services."
http://gaeaglobal.com/,Programming,95,Gaea is a technology consulting firm founded and staffed by engineers who architect and implement complex Oracle enterprise software solutions.
http://www.revvlocity.com/,Sales,100,"Revvlocity is a B2B company whose entire business model is built around providing sales-driven solutions like lead generation, appointment setting, and sales analytics."
https://www.dishahconsultants.com/sales-training-in-bangalore,Sales,100,"The company is a corporate training and consulting firm that specializes exclusively in sales, leadership, and business communication."
https://global-value-web.com/,Programming,95,"The company's core business is providing data-centric technology solutions like SaaS, intelligent automation, and value chain analytics to the pharma and life sciences industries, indicating a strong need for technical and programming expertise."
http://www.marconix.in/,Sales,100,"Marconix is explicitly a sales outsourcing company whose entire suite of services, from 'Sales as a Service' to 'Field Sales', revolves around driving revenue and growth for its clients."
http://salesjobsindia.com/,Sales,100,The institution is a specialized job portal exclusively dedicated to connecting employers with sales and marketing professionals across India.
http://www.digitalimac.com/,Sales,95,"This company is a results-driven digital marketing agency entirely focused on generating leads, increasing sales, and boosting revenue for its clients."
https://www.salesmagnitude.com/,Sales,98,The company's name is 'Sales Magnitude' and its core business is a performance marketing agency focused on generating leads and increasing sales for its clients.
https://www.digimarkagency.com/?utm_source=GMB&utm_medium=Organic&utm_campaign=Main,Sales,95,"The company is a B2B digital marketing agency whose website and open roles (Business Development Manager, Customer Success Manager) are heavily focused on client acquisition, lead generation, and demonstrating ROI."
https://www.marketstar.com/?utm_source=gmb&utm_medium=organic&utm_campaign=gmb-listing-blr,Sales,100,"MarketStar is a global leader in B2B sales outsourcing, and their entire business model is built around providing expert, end-to-end sales solutions for other companies."
https://www.sagesoftware.co.in/,Sales,95,"The company's primary business is selling and distributing CRM and ERP software solutions, indicating a core focus on sales and customer acquisition."
https://www.csquare.in/,Sales,95,"This software company's growth is heavily reliant on a sales-driven model, evidenced by its dedicated Sales Force Automation (SFA) product and extensive channel partner program."
https://www.atctools.com/,Sales,95,"This company is an e-commerce retailer whose leadership team and open job roles, such as 'Sales Team Supervisor' and 'Sales Consultant', are explicitly focused on sales and commercial activities."
http://www.ferozes.com/,Sales,98,"The company is a real estate marketing firm whose primary business of buying, selling, and renting properties is fundamentally driven by the sales and negotiation skills of its agents and property consultants."
http://inoptra.com/,Programming,99,"The company's core services, company mission, and extensive list of technical job openings overwhelmingly indicate a focus on engineering and digital technology solutions."
https://betadigitalmarketing.com/,Sales,95,"As a digital marketing agency, the company's core business is selling its marketing, SEO, and web design services to other businesses, making sales skills essential for client acquisition and growth."
https://www.regortz.com/,Sales,95,"As a B2B digital marketing agency, their entire business model is centered on generating leads and sales for clients, making advanced sales skills fundamental to their own growth."
https://bangalorejobhub.com/,Sales,95,"The website is a job portal that predominantly lists and categorizes sales-driven roles such as 'Business Development,' 'Lead Generation,' and 'Tele Sales'."
http://bluechipcorporation.in/,Sales,5,"The website provides no information about the company's industry, but as a new venture, it will universally require sales expertise for customer acquisition."
https://www.bangaloresalescorporation.com/,Sales,98,"The company's name is 'The Bangalore Sales Corporation' and its business is explicitly defined as a trader, wholesaler, and exporter, making it a quintessentially sales-driven organization."
https://anumak.com/,Programming,95,"The company's consulting services, technical case studies, and job openings for roles like MLOps Engineer and Data Consultant show a primary focus on technology, data science, and AI."
https://nexaweb.in/,Sales,95,"The company's entire value proposition is centered on increasing revenue, boosting online sales, and maximizing conversions for its clients, indicating it is a fundamentally sales-driven organization."
http://enceeenterprises.in/,Sales,95,"As a direct dealer of electronic products for over 25 brands catering to both B2B and B2C customers, the company's core business is fundamentally sales-driven."
https://www.beacon-india.com/?utm_source=google%20maps&utm_medium=website%20button&utm_campaign=bangalore,Programming,95,"The company is a premier reseller and trainer for advanced engineering and 3D design software like SOLIDWORKS, with a focus on technical expertise and customization via APIs, indicating a strong need for programming skills."
https://www.percoyo.com/,Sales,95,"As a digital marketing agency, the company's core business is fundamentally centered on ROI-focused marketing and generating leads to drive sales for its clients."
http://www.maheshhotelware.com/,Sales,98,"The company is a B2B manufacturer, supplier, and dealer whose entire business model revolves around selling kitchen equipment and fostering customer relationships."
https://proaxissolutions.com/,Programming,98,This company is a specialized cybersecurity and digital forensics firm whose core services rely entirely on advanced technical and programming expertise.
http://sellercenter.in/,Sales,95,The company's entire business model is centered on providing e-commerce solutions to help their clients grow online sales and optimize their marketplace performance.
https://brandeas.com/,Sales,95,"The company is a B2B media and business consulting agency focused on brand strategy, marketing, and profit growth, making advanced sales skills essential for acquiring high-value corporate clients."
https://www.instagram.com/aluniquetraders/profilecard/?igsh=MThpbXJpOGlsbnRoZQ==%20https://youtube.com/@aluniquetraders?si=1zNJYE0m4kJEkBjx,Sales,95,The company's profile as a 'Direct To Retail Distributor of Fast Moving Consumer Goods' indicates its core operations are fundamentally centered around sales and distribution.
https://retailgurukul.com/,Sales,98,"The company is a consultancy and training firm that specializes in improving sales performance, staff training, and business growth for the retail jewellery industry."
https://www.instagram.com/genuine_x_distribution_?igsh=MTRwcjd2b2VjdG1wNg==,Sales,95,"This company is an importer and distributor focused on selling retail products, making sales training highly relevant to their core business operations."
http://sclgaming.in/,Programming,92,"The company's focus on building and selling gaming PCs, inferred from the URLs, indicates a strong need for technical and programming skills to develop and support their products."
https://www.skimbox.co/,Programming,98,"SKIMBOX is a technology consultancy specializing in cutting-edge development services like AI, Web3, and product engineering, which requires a highly skilled technical workforce."
https://www.bharathisystems.com/,Programming,95,"The company is a highly technical IT solutions and services provider specializing in areas like network security, virtualization, and cloud infrastructure, making programming skills essential for their core business."
http://www.tridentmachines.com/,Sales,95,"As a manufacturer, wholesaler, exporter, and trader of industrial machinery, the company's success is fundamentally driven by its experienced sales and service teams."
http://www.bigmarketingworks.com/,Sales,95,"As a marketing agency focused on lead generation and business growth for its clients, advanced sales skills are fundamental to its core business operations and success."
http://www.bmsce.ac.in/,Programming,98,"The institution is a dedicated engineering college with an extensive list of technology-focused departments, including Computer Science, AI, Machine Learning, and IoT, indicating a strong need for programming skills."
http://www.msrit.edu/,Programming,99,"As a top-ranked engineering institution with a vast majority of its programs in Computer Science, AI, and various engineering fields, plus a dedicated Apple Authorized Training Center, the school has an overwhelming focus on technology."
http://www.dsce.edu.in/,Programming,98,"As a leading College of Engineering, the institution offers a comprehensive array of undergraduate and postgraduate programs heavily focused on computer science, AI/ML, data science, and other technical specializations."
https://bit-bangalore.edu.in/,Programming,98,"The institution's name, 'Bangalore Institute of Technology', and its tagline, 'Technology for Prosperity', clearly indicate a primary focus on engineering and technical education."
https://www.mvjce.edu.in/,Programming,98,"The institution is an engineering college with an overwhelming majority of its programs, leadership, and centers of excellence dedicated to technical fields like computer science, AI, and aerospace engineering."
https://uvce.ac.in/,Programming,98,"The institution is a dedicated engineering college with a strong emphasis on Computer Science, Information Science, and Artificial Intelligence departments."
https://newhorizoncollegeofengineering.in/,Programming,98,"The institution is an engineering college with a curriculum heavily focused on technology, computer science, and AI/ML, making programming skills essential for its students."
https://rvce.edu.in//,Programming,100,"The institution is a dedicated College of Engineering with departments, research focus, and industry partnerships overwhelmingly centered on technology and programming-related fields."
https://www.acharya.ac.in/,Programming,95,"The institution has a dedicated Institute of Technology, a technology-focused business incubator, and extensive industry collaborations and enrichment programs with major tech companies like IBM, Capgemini, and Siemens."
https://drait.edu.in/,Programming,95,"The institution is an engineering college with numerous technology-focused departments like Computer Science and AI/ML, and its placement cell partners with major tech recruiting companies."
http://www.sjbit.edu.in/,Programming,98,"The institution is an engineering college with a significant majority of its students, academic programs, and industry partnerships focused on technology and computer science."
http://www.eastpoint.ac.in/,Programming,95,"The institution features a dedicated College of Engineering and Technology, indicating a strong focus on technical education for its students."
http://www.sirmvit.edu/,Programming,98,"The institution is an Institute of Technology with an overwhelming majority of its undergraduate and postgraduate degrees focused on engineering and computer science, attracting top technology companies for placements."
https://dbit.co.in/?utm_source=GMB&utm_medium=profile&utm_campaign=Website_Clicks,Programming,98,"The institution is an engineering college with an explicit and overwhelming focus on technology programs such as Computer Science, AI, and Data Science."
https://www.gopalancolleges.com/gcem/,Programming,98,"The institution is an engineering college with a strong focus on technical disciplines like Computer Science, AI/ML, and Data Science, and even hosts events on Python and machine learning."
https://ncet.co.in/,Programming,95,"The institution's website title explicitly identifies it as one of the 'Best Engineering Colleges in Bangalore', indicating a primary focus on technical education."
https://www.svcengg.edu.in/,Programming,95,"The institution is a College of Engineering with the vast majority of its programs centered on computer science, AI, data science, and other technical engineering disciplines."
http://jyothyit.ac.in/,Programming,98,"The institution is a dedicated Institute of Technology with a strong emphasis on R&D, student incubations, and hosting technical events like hackathons, gameathons, and robothons."
http://www.gat.ac.in/,Programming,95,"The Global Academy of Technology is an engineering college with a curriculum heavily focused on computer science, AI, and data science, indicating a primary need for advanced programming skills."
http://www.jssateb.ac.in/,Programming,98,The institution is an Academy of Technical Education with a vast majority of its undergraduate and postgraduate programs dedicated to engineering and computer science disciplines.
http://www.ksit.ac.in/,Programming,100,"The institution is explicitly an engineering college with a strong focus on technology, offering numerous programs like Computer Science, AI & Machine Learning, and IoT."
https://dsatm.edu.in/,Programming,95,"The institution is an Academy of Technology with a vast majority of its undergraduate programs heavily focused on specialized computer science and engineering fields like AI, Data Science, and Cyber Security."
http://www.christuniversity.in/,Sales,90,"The university has strong Schools of Business and Management, and Commerce, with an extensive list of distinguished alumni in prominent business leadership and executive roles."
http://www.bgscet.ac.in/,Programming,0,"No content could be retrieved from the provided website, making an informed recommendation impossible."
http://pes.edu/,Programming,95,"The university's faculty includes directors for Cloud Computing, Big Data, Data Sciences, and Applied Machine Learning, indicating a strong institutional focus on technology."
https://vemanait.edu.in/,Programming,100,"The institution is an engineering college with a curriculum exclusively focused on technology, computer science, AI, and data science, making programming courses a perfect fit."
https://www.kssem.edu.in/,Programming,98,"The institution is overwhelmingly an engineering college with numerous undergraduate programs in fields like AI & Data Science and Computer Science, and a placement history dominated by major IT and technology companies."
https://www.hkbk.edu.in/,Programming,98,"The institution's website explicitly identifies it as a leading engineering and B.Tech college, indicating a strong focus on technical education."
http://www.acsce.edu.in/,Programming,95,"The institution is an engineering college with a heavy emphasis on technology, offering multiple specialized degrees in computer science, AI/ML, data science, and cyber security."
http://www.theoxford.edu/engineering/,Programming,98,"The institution is explicitly an engineering college offering numerous technical degrees and providing domain-specific training in Python, Big Data, and Machine Learning to its students."
https://www.bnmit.org/?utm_source=GMB&utm_medium=organic,Programming,98,The institution is an Institute of Technology with a vast majority of its students enrolled in engineering and computer science programs like AI & Machine Learning and Computer Science.
http://www.sapthagiri.edu.in/,Programming,100,"The institution is exclusively a College of Engineering with a strong focus on technical disciplines like Computer Science and Information Science, making programming courses a perfect fit for their students."
http://www.rrce.org,Programming,98,"The institution is a dedicated College of Engineering with an overwhelming focus on technology, offering numerous advanced programs in areas like AI/ML, IoT, Cybersecurity, and Robotics."
http://www.msec.ac.in/,Programming,98,"The institution is an engineering college with numerous departments heavily focused on technology, including Computer Science, AI & Machine Learning, and Data Science."
https://www.jainuniversity.ac.in/,Programming,10,A confident recommendation cannot be made as the website content could not be retrieved for analysis.
https://www.skit.org.in/index.html,Programming,100,"The institution is an engineering college with departments exclusively focused on technology, such as Artificial Intelligence, Computer Science, and Information Science."
http://www.sambhramit.com/,Programming,98,"Sambhram Institute of Technology is a dedicated engineering college with a curriculum heavily focused on computer science, AI, and other technical disciplines, making advanced programming courses highly relevant for its students."
