Website,Course,Score,Reasoning
http://gtbit.ac.in/,Programming,100,"The institution is a dedicated Institute of Technology offering multiple engineering branches heavily focused on Computer Science, AI, and Machine Learning, with placements in top IT companies."
https://dseu.ac.in/ashok-vihar/,Programming,95,"The university offers multiple Bachelor of Technology degrees, including Computer Science & Engineering and Data Analytics, indicating a strong focus on technical skills."
https://donboscoitggsipu.org/,Programming,95,"The institution is an Institute of Technology with dedicated computer application degrees (BCA/MCA) and a strong placement record with major IT companies like Infosys, TCS, and HCL."
http://piem.ae/,Programming,95,"The institution's name is the Pacific Institute of Engineering and Management, and it offers a vast array of engineering and computer science programs, indicating a strong technical focus."
http://gtb4cec.org/,Programming,98,"The institution is an engineering college that explicitly specializes in technical B.Tech degrees like Computer Science, AI/ML, and Data Science."
http://delhitechnicalcampus.ac.in/,Programming,98,"The institution is a technical campus with multiple departments and degrees dedicated entirely to computer science, artificial intelligence, and data science."
http://dseu.ac.in/,Programming,95,"The university offers a wide range of technical degree and diploma programs, including B.Tech in multiple engineering disciplines and a B.Sc. in Data Analytics, indicating a strong institutional focus on technology."
https://dseu.ac.in/pusa/index.html,Programming,85,"The university offers a robust selection of technical degrees, including multiple B.Tech specializations, a BCA, and a B.Sc in Data Analytics, indicating a strong institutional focus on technology-centric skills."
https://jamiahamdard.ac.in/,Programming,95,"The institution offers numerous specialized technology degrees, including B.Tech and M.Tech in CSE, AI, and Data Science, and promotes its tech focus with a 5G lab and Google Developer workshops."
https://www.eitfaridabad.com/,Programming,95,"The institution is an engineering college with an overwhelming majority of its programs and student enrollment dedicated to Computer Science, AI, Data Science, and other technology-focused B.Tech degrees."
http://www.dcfse.com/,Sales,45,"The institution offers consultancy services and prepares students for roles where they may need to persuade organizations to adopt safety measures, making sales skills tangentially relevant."
http://dducollegedu.ac.in/,Programming,90,"The institution features dedicated departments for Computer Science and Electronics, alongside student clubs for Robotics and Data Analytics, indicating a strong technology focus."
https://manavrachna.edu.in/international-institute-of-research-and-studies/,Programming,95,"The institution prominently features its highly-ranked and accredited School of Engineering & Technology and School of Computer Application across its website, indicating a strong focus on technical education."
https://hinducollege.ac.in/index.aspx,Programming,85,"The institution is establishing an Artificial Intelligence (AI) training and innovation lab, indicating a strategic investment and clear demand for programming skills."
http://andcollege.du.ac.in/,Programming,95,"The college has dedicated departments for Computer Science and Electronics, alongside numerous other science disciplines, indicating a strong institutional focus on technology and research."
http://vips.edu/,Programming,98,The institution's designation as a 'Technical Campus' and its involvement with Azure cloud services and software development indicate a strong focus on technology.
https://www.sbsc.in/,Sales,95,"The institution is heavily focused on Commerce, Economics, and business disciplines, with a 'Campus to Corporate' initiative and prominent alumni in corporate leadership, making sales training highly relevant."
http://www.aurobindo.du.ac.in/,Sales,80,"The college offers strong commerce programs (B.Com, B.Com(H)) and its alumni are well-placed in banking, finance, and entrepreneurship, indicating a high demand for business-related skills."
http://www.deshbandhucollege.ac.in/,Sales,75,"The college has strong Commerce and Economics departments, and its placement cell leadership is heavily composed of students from these disciplines, indicating a focus on corporate roles where sales skills are valuable."
https://www.du.ac.in/,Programming,95,"The institution has dedicated Faculties of Technology and Mathematical Sciences, including Computer Science and Engineering departments, and hosts numerous events focused on programming, AI, and cybersecurity."
https://jmi.ac.in/,Programming,95,"The institution has a dedicated Faculty of Engineering and Technology with numerous technical departments, including Computer Engineering, Computer Science, and Electronics & Communication Engineering."
http://vidyapark.in/,Sales,95,"The institution is an educational consultancy whose core business function is advising and placing students, a role that relies heavily on consultative sales skills."
http://bvicam.in/,Programming,98,"The institution's name, 'Institute of Computer Applications and Management', and its flagship Master of Computer Applications (MCA) program clearly indicate a strong focus on technical and programming skills."
http://nimesedu.in/,Programming,90,"The institution identifies as a top engineering institute and offers numerous dedicated computer science degrees, such as BCA, BSc-CS, MCA, and MSc-CS, which directly align with programming courses."
http://www.delhipolytechniccollege.com/,Programming,95,"The institution is a polytechnic college with a strong emphasis on engineering disciplines, including multiple diploma and B.Tech programs in Computer Science and Computer Engineering."
http://www.dtu.ac.in/Web/Departments/DSM/about/,Sales,95,"The institution is the Delhi School of Management, which focuses on developing innovative managers and future leaders by imparting managerial competence and business knowledge."
https://www.amity.edu/,Programming,95,"The university's extensive engineering and computer science programs, coupled with over 2130 patents filed, indicate a strong institutional focus on technology and innovation."
http://www.bvimr.com/,Sales,98,"The institution is an Institute of Management & Research offering MBA and BBA degrees, making a sales curriculum highly relevant for its students."
http://www.ate.ind.in/,Programming,95,"The institution's name is 'Alpha Technical Education' and it offers comprehensive degree programs in Engineering and Information Technology, indicating a primary focus on technical skills."
https://rajdhanicollege.ac.in/,Programming,95,The institution offers dedicated degrees in Computer Science and Electronics and hosts numerous technical events and workshops on specific topics like Python and Arduino programming.
https://dsim.in/digital-marketing-course-in-delhi/?utm_source=GMB&utm_medium=Listing&utm_campaign=Organic,Sales,98,"The institution is a digital marketing school focused on sales-driving activities such as lead generation, increasing business revenue, and customer acquisition strategies."
https://www.kalindicollege.in/,Programming,95,"The college has a dedicated Computer Science department, offers a B.Voc in Web Designing, and its placement cell organizes workshops on data analytics and ethical hacking."
https://delhicourses.in/course/digital-marketing-courses-online-offline-india.html,Sales,95,"The institution specializes in digital marketing courses, which are fundamentally designed to drive business growth and sales."
https://www.nsim.in/,Sales,90,"The institution's core identity is as a digital marketing school, with a curriculum heavily focused on sales-oriented outcomes like lead generation, persuasion skills, and e-commerce marketing."
http://digitalinventive.in/,Sales,95,The institution specializes in digital marketing with a strong focus on practical skills like 'Lead Generation for Business' and 'E-Commerce Marketing' which directly support sales functions.
https://www.dmsn.in/,Sales,95,The institution's core offering is digital marketing training with explicit modules on 'Digital Sales Optimization' and 'Acquiring Business Lead Generation' to help professionals and entrepreneurs increase business sales.
http://www.ddmschool.com/,Sales,95,"The institution's curriculum is entirely focused on digital marketing, a discipline dedicated to generating leads and converting them into customers, which directly aligns with sales functions."
https://www.didm.in/,Sales,95,"The institution is exclusively focused on digital marketing training, teaching students skills like lead generation, SEO, and advertising to drive business growth, which directly aligns with sales functions."
https://didm.in/,Sales,95,"The institution is a specialized digital marketing institute focused on training professionals in lead generation and business growth, making a sales course a highly complementary offering to convert marketing efforts into revenue."
https://www.ndimdelhi.org/,Sales,98,"As a premier business school with an explicit focus on marketing, industry placements, and a 'Programme on Sales Training for Beginners', the institution is perfectly aligned with sales-oriented curriculum."
https://www.didm.in/digital-marketing-course-in-satya-niketan,Sales,95,"The institution is entirely focused on digital marketing, which directly supports lead generation and business growth, making a sales curriculum a highly complementary offering."
http://www.aoreindia.com/,Sales,95,"The institution, named the 'Academy Of Retail Excellence', exclusively offers courses in retail management, marketing, and customer service, directly aligning with sales-focused career paths."
https://www.dsdm.in/,Sales,95,"The institution specializes in digital marketing, a discipline fundamentally aimed at generating leads and driving sales for businesses through channels like SEO, PPC, and e-commerce."
https://www.didm.in/,Sales,95,"The institution is a specialized school for digital marketing, which teaches skills directly related to lead generation, customer acquisition, and business growth that are fundamental to modern sales."
https://empi.ac.in/,Sales,95,"As a business school offering PGDM specializations in Marketing, Finance, and International Business, sales training is a core, universally applicable skill for its students entering the corporate world."
https://www.kraftshala.com/,Sales,100,"The institution is an online school that explicitly specializes in job-linked marketing and sales training programs, including a dedicated 'PGP in Sales, Marketing and Business Leadership'."
https://www.asiapacific.edu/,Programming,0,"The provided website content is a non-functional redirect page, offering no information to determine the institution's academic focus."
http://www.tiemdelhi.com/,Sales,98,"The institution is a business school that explicitly offers multiple degrees with specializations in Sales Management and Sales & Marketing, making a sales course highly relevant."
https://www.fsm.ac.in/,Sales,95,"As a leading business school focused on management education and developing corporate leaders, sales training is a fundamental and highly relevant skill for its students."
http://www.fostiima.org/,Sales,98,"As an institution named 'FOSTIIMA Business School' offering PGDM/MBA programs founded by IIM alumni, its primary focus is clearly on business management and leadership development."
https://ndiit.org/,Sales,95,The institution is explicitly a business school offering a Post-Graduate Diploma in Management with a marketing specialization that includes a 'Sales & Distribution Management' course.
