Website,Course,Score,Reasoning
https://www.webmarketingacademy.in/,Sales,95,"The institution is a digital marketing academy focused on training professionals in lead generation, advertising, and business growth strategies, which are all integral components of the modern sales process."
https://nidmindia.com/,Sales,98,"The institution is a specialized digital marketing training institute focused on skills like lead generation, paid advertising, and entrepreneurship, which are all integral to modern sales strategies."
http://btibangalore.org/,Programming,100,"The institution is a dedicated engineering college with comprehensive Bachelor of Engineering programs, numerous specialized programming labs, and a vast array of technical value-added courses in areas like AI, ML, and full-stack development."
https://streamlynacademy.com/,Sales,95,"The institution is a digital marketing academy focused on training professionals for business growth and customer acquisition, which aligns directly with sales skills."
https://www.indrasacademy.com/,Programming,95,"The institution's strong focus on technical training, with existing courses in Data Science, Web Development, Full Stack Development, and Python, indicates a clear alignment with programming content."
https://www.emarketeducation.in/,Sales,95,"The institution's core identity, primary course offerings, and student job placements are overwhelmingly focused on digital marketing, which is a fundamental component of modern sales."
https://www.aimsibs.com/?utm_source=gmb&utm_medium=website-button,Sales,95,"The institution's name, AIMS IBS (International Business School), indicates a strong focus on business education, making sales training highly relevant."
http://www.isme.in/,Sales,98,"As an award-winning International School of Management Excellence that offers numerous business and marketing-focused degrees like MBA/PGDM and BBA, a Sales course is perfectly aligned with its core curriculum."
http://www.sjim.edu.in/?utm_source=GMBListing&utm_medium=organic,Sales,95,The institution is a dedicated business school offering a Post Graduate Diploma in Management with specializations in Marketing and a focus on preparing students for sales and business development roles.
https://www.bimsbangalore.org/,Sales,95,"The institution is explicitly branded as a 'B-School' (Business School) with core programs like MBA and BBA, making a sales curriculum highly relevant for their students."
https://www.gibs.edu.in/,Sales,95,"As a top-ranked business school explicitly focused on corporate placements with MBA, BBA, and PGDM programs in Marketing, a Sales course is highly relevant for its students."
https://theaims.ac.in/,Sales,95,"The institution identifies as a top business and hospitality school, with a strong focus on programs like MBA, BBA, and management placements."
http://www.ibmribscollege.com/,Sales,98,"The institution is a dedicated business school that exclusively offers management and business administration degrees such as MBA and BBA, which directly align with a sales-focused curriculum."
http://www.iibs.edu.in/bangalore-college,Sales,98,"The institution is exclusively a business school offering MBA specializations like Marketing Management, making a sales-focused course directly aligned with its curriculum and student career goals."
https://jagsom.edu.in/?utm_source=Google&utm_medium=organic&utm_campaign=gmb,Sales,95,"The institution is an AACSB-accredited business school specializing in management programs like Marketing, Finance, and MBA, making a Sales course highly relevant for its students."
https://www.excelr.com/data-science-course-training-in-bangalore?utm_source=SEO&utm_medium=GoogleLocal&utm_campaign=GMB_BLR&utm_location=BTM_Layout,Programming,98,"The institution's extensive course catalog is overwhelmingly focused on highly technical subjects like data science, AI, software development, and cloud computing."
http://onlinism.com/,Sales,95,"The institution is a digital marketing training school focused on selling SEO services and driving business growth, making sales skills essential for its students to acquire clients."
https://www.kristujayantimba.edu.in/,Sales,95,"As a premier business school offering multiple MBA programs, the curriculum strongly emphasizes leadership, marketing, and employability skills that are directly relevant to sales careers."
https://ibmrbangalore.in/,Sales,95,"As a highly-ranked business school focused on management and leadership, offering MBA and PGPM programs, a sales curriculum directly aligns with its core mission to prepare students for the global business community."
http://www.nsom.ac.in/,Sales,95,"As a dedicated business school, Nitte School of Management's PGDM in Marketing explicitly prepares students for careers as Sales Managers and Business Development Managers, emphasizing sales leadership and negotiation skills."
https://skillfloor.com/digital-marketing-courses-in-bangalore,Programming,98,"The institution is a career-oriented training school with a vast majority of its courses heavily focused on technical skills like Development, Data Science, AI, and Cloud Computing."
https://www.rcmb.in/,Sales,98,The institution is a dedicated business school offering MBA and PGDM programs with specializations and value-added certifications in areas like 'Sales Management' and places students in sales-driven industries.
http://adarshaimit.org/,Sales,98,"The institution is explicitly a top-ranked business school offering an MBA with a strong focus on management, marketing, and preparing students for corporate careers."
https://rdsdigital.in/,Sales,95,"As a digital marketing agency, the company's core business is acquiring and retaining clients through selling their services, which makes advanced sales skills critical for their growth."
https://www.isbmb.ac.in/,Sales,98,"The institution is an international business school offering a PGDM with a specialization in Marketing and has alumni in Business Development roles, indicating a clear focus on sales-related careers."
https://dsbs.edu.in/,Sales,95,"The institution is explicitly a business school offering PGDM programs with specializations in areas like Marketing Management, which aligns directly with sales skills."
http://www.bsbsbschool.com/,Sales,100,"The institution is a business school with academic subjects, corporate projects, and graduate placements all explicitly centered around sales, marketing, and customer relationship roles."
https://designerrs.com/,Programming,95,"This institution is a specialized school focused on designing technical products like apps and websites, making programming a highly complementary skill for its students entering the tech industry."
https://www.onesb.edu.in/,Sales,98,"The institution is a top-ranked business school specializing in MBA programs, making a sales curriculum highly relevant for its students."
https://www.iibs.edu.in/,Sales,98,"The International Institute of Business Studies is a dedicated business school specializing in MBA programs, including Marketing Management, making sales training a highly relevant skill for its students."
http://ipecsolutions.com/,Programming,100,"The institution is a software and IT training company that exclusively focuses on developing and teaching technical subjects like AI, Data Science, and Python programming."
https://www.imciindia.org/,Sales,99,"The institution's name, mission, and list of offered programs, including 'Sales and Marketing Management,' are entirely focused on business, marketing, and communications."
https://upgrad.com/,Programming,95,"The institution has an extensive and specialized catalog of courses with a strong emphasis on high-demand technology fields like AI, Machine Learning, Data Science, and Software Development."
https://samtechnologies.org/,Sales,95,"The institution is a digital marketing agency whose entire service offering, from bulk SMS to web design, is focused on helping clients grow their sales."
http://www.indusvalleycollege.com/,Programming,95,"The institution's partnership with 'Learning Digital' to offer specialized courses in Cloud Computing and Artificial Intelligence, alongside a Bachelor of Computer Applications (BCA) degree, indicates a strong focus on technology."
https://www.brandlution.com/,Sales,95,"This institution is a digital marketing agency and academy whose core services and curriculum are centered on lead generation, client acquisition, and sales-driven marketing strategies."
https://northstaracad.com/,Sales,95,"North Star Academy is a specialized training institute focused exclusively on finance and accounting certifications, making a sales course highly relevant for their students' career paths."
http://www.agieducation.org/,Sales,95,"The institution heavily promotes itself as a top college for aspiring management professionals, with a strong focus on its Bachelor of Business Administration (BBA) program and specializations in Marketing and Entrepreneurship."
https://www.itvedant.com/?utm_source=GMB&utm_medium=organic&utm_campaign=gmb-listing-Bengaluru,Programming,100,"This institution is an IT training institute whose entire curriculum is dedicated to technical skills like Data Science, AI, Python, Java, and DevOps."
https://www.iigsouth.com/,Sales,95,"The institution trains professionals for the sales-driven gems and jewelry industry, with its jobs page explicitly listing roles like 'Sales Associate' and 'Corporate Sales Trainer'."
http://www.skillhacc.com/,Programming,98,"The institution's website heavily emphasizes its extensive computer science course offerings, faculty expertise in software development, and its core mission to create 'industry-ready techies'."
http://www.eastpoint.ac.in/,Programming,95,"The institution features a prominent College of Engineering and Technology with departments in Computer Science, AI & Machine Learning, and Information Science."
https://dsc.edu.in/,Sales,95,"The Delhi School of Communication is a business school specializing in marketing, advertising, and communications, with 'Advertising and Sales Promotion' explicitly listed as a core subject."
http://www.exoticdisplay.com/,Sales,95,The company is a B2B manufacturer and supplier focused on marketing and selling its physical products to schools and businesses.
https://www.achieversit.com/?utm_source=organic&utm_medium=local-seo&utm_campaign=btm,Programming,100,"This institution is an IT training center that exclusively offers a comprehensive range of courses in software development, cloud computing, data science, and other technical disciplines."
https://www.bangaloreculinaryinstitute.com/,Sales,90,"The institution offers degrees in Hotel Management which include modules like Marketing Management, indicating a strong need for business and customer-facing sales skills in the hospitality industry."
https://www.internzlearn.com/,Programming,0,A recommendation cannot be made as the website content was not accessible.
https://www.edureka.co/,Programming,98,"The institution's course catalog is overwhelmingly focused on highly technical skills like AI, cloud computing, DevOps, data science, and software development, indicating a strong engineering and technology focus."
https://www.saffrontech.net/,Programming,95,"The company is an IT solutions provider that heavily emphasizes its technical expertise, custom software development services, and its team of over 250 engineers."
https://www.saffrontech.net/,Programming,98,"The company is an IT solutions provider specializing in software, mobile, and web app development, employing over 250 engineers and highlighting extensive expertise in specific development tools and technologies."
https://www.aziels.com/,Sales,95,"The company is a technology and recruitment firm with multiple open sales/business development roles, indicating a strong need to support its primary growth engine."
https://asthatechnologies.org/mobile-app-development-company-delhi/,Programming,95,"The company's core business is providing technology-centric services like mobile app development, web development, and software solutions, making advanced programming skills essential for their growth."
https://www.nexgi.com/,Programming,95,The company is a software development firm whose core services and majority of job openings are centered around technical programming roles like web and app development.
https://www.techasoft.com/,Programming,95,"The company's URLs explicitly identify it as a 'Software-Development-Company' and 'software-training-company', indicating a core focus on technology skills."
http://www.xicom.biz/,Programming,99,Xicom is a software development and digital transformation company whose entire business model is based on providing a wide range of technology and programming services.
https://vlstechnology.com/,Sales,95,"As a B2B company that develops and sells HR and CRM software to other businesses, enhancing the skills of their sales team is crucial for driving revenue and customer acquisition."
https://techpertz.com/,Programming,95,"Techpertz is an IT solutions company whose core services in website, mobile app, and custom software development are fundamentally dependent on strong programming expertise."
https://www.mobiloitte.com/,Programming,98,"The company's entire business model is built on providing advanced, programming-intensive technology solutions in AI, Blockchain, IoT, and application development."
http://www.razorinfotech.com/,Programming,95,"The company has a dedicated and extensive software development division offering custom solutions, mobile apps, and SaaS products, which indicates a strong, core focus on technology."
http://www.4techbugs.com/,Programming,95,"The company's core business is explicitly software, web, and mobile application development, indicating a primary need for advanced technical and programming skills."
http://www.canticleindia.com/,Programming,95,"The company's core business is custom software and mobile app development, making advanced programming skills essential for their product innovation."
https://www.techmapperz.com/,Programming,98,"The company is a dedicated IT and GIS solutions provider whose core business relies on a wide and modern technology stack, indicating a primary need for advanced programming skills."
http://www.itechmission.org/,Programming,100,"The company is a data science and information technology solutions provider actively hiring for multiple developer roles including Java, Python, and MEAN/MERN stack engineers."
https://www.muniwar.com/,Sales,95,"This digital marketing agency's primary business objective is to generate leads and fundamentally boost sales for its clients, making advanced sales training highly relevant."
https://www.perfectiongeeks.com/,Programming,98,"The company is a software development agency with an extensive portfolio of technical services, a vast list of supported programming languages, and a team composed of developers and engineers."
https://lckdigitalmedia.in/,Programming,95,"The company's core services are explicitly focused on technical development, including website design, mobile application development, and UI/UX design."
https://www.rssindia.com/,Programming,95,"The company is a software development firm whose core services are centered on programming, web/app development, and using a wide array of modern technologies."
https://www.techkul.com/,Programming,95,"The company's primary services are in AI/ML, software development, web design, and mobile app creation, with current job openings exclusively for senior developer and programmer roles."
https://www.corewave.io/,Programming,98,"The company's core business is providing custom software, AI, and mobile application development services, which requires a strong and constantly updated foundation in programming."
https://www.esc.co.in/,Programming,95,"The company's core business is providing high-performance computing, supercomputers for AI/ML, and cloud infrastructure, which necessitates a deeply technical and programming-focused workforce."
https://www.wtsnetindia.com/,Programming,95,"The company identifies as a software and web development firm, lists numerous technical services, and has more open job requisitions for developers than for any other role."
https://www.deepspace9.tech/,Programming,98,"The company's core business is providing software solutions, with services centered around web/app development, data visualization, and the use of cutting-edge programming technologies."
https://www.vijprat.com/,Programming,95,The company's self-identification as a 'Cloud Solutions' provider indicates a strong focus on technology and a core need for programming expertise.
https://softkwit.in/mlm-software.php,Programming,95,"The company's core services are exclusively focused on technology, including web design, software development, and web application development."
https://fusionsofttechnologies.com/,Programming,95,"The company is a full IT service agency specializing in custom software, application, and website development, making advanced programming skills essential for their core business operations."
http://www.manprax.com/,Programming,98,"The company is a software development and technology consulting firm whose core services, platforms, and even blog content are explicitly focused on engineering and programming."
https://www.techjockey.com/,Sales,95,"As a B2B software marketplace connecting thousands of vendors with millions of buyers, the company's core business function is driven by sales and expert consultation."
https://www.nethues.com/,Programming,98,Nethues Technologies is a software development company whose core business is providing a wide range of technical services and skilled developers to its clients.
https://www.aliqantechnologies.com/,Programming,95,"ALIQAN Technologies is a technology-oriented company specializing in web/mobile development and technical staffing, making advanced programming skills essential for their core business operations."
http://www.aquevix.com/,Programming,98,"The company is an award-winning, engineering-focused software development firm that explicitly details an extensive list of programming languages, frameworks, and technologies as core to its services."
https://w2gsolutions.in/,Programming,98,"The company's core business is explicitly stated as software and web development, with a team of IT professionals and software engineers who build custom applications."
http://www.lodhitech.com/,Programming,95,"The company is a software and web development firm whose core services, from CRM/ERP development to mobile apps and custom websites, are fundamentally based on programming skills."
https://www.opensenselabs.com/,Programming,98,"The company is a digital transformation agency specializing in highly technical services like Drupal development, cloud engineering, and product engineering, indicating a core need for advanced programming skills."
http://www.newgencampus.com/,Programming,95,"The company's core business is developing and implementing advanced technology solutions like AI, Robotics, and ERP software, indicating a primary need for skilled technical talent."
http://lineadigitech.net/,Programming,98,"The company is a next-generation IT solutions provider with a core focus on highly technical services like web development, AI, blockchain, and AR/VR, making advanced programming skills essential."
http://www.bsquare.in/,Programming,95,"The company's primary identity is a 'Software Development Company' that builds and customizes complex technology solutions like ERP systems, making technical proficiency a core business requirement."
https://traversia.net/,Programming,95,"Traversia is an IT solutions provider that specializes in advanced technology solutions, including custom web development, mobile app creation, and SaaS platforms."
http://inspiredpos.in/,Sales,95,This company is an IT solutions and Point-of-Sale (POS) system provider whose website is heavily focused on selling hardware and software products to a wide range of B2B clients.
http://www.pccsoftech.com/,Programming,95,"The company explicitly identifies as a software and technology firm, and their portfolio extensively details programming tools and development projects."
https://www.yoctel.com/,Programming,95,Yoctel is an educational technology company that develops a wide range of software solutions and is actively hiring for multiple software developer roles.
https://www.arramton.com/,Programming,98,Arramton Infotech is a dedicated software and application development company whose core business is built entirely on providing advanced technology and programming solutions to its clients.
http://gdtechsolution.com/,Sales,90,"This digital marketing agency's core mission is to 'increase sales' for its clients, making it a prime candidate for sales-focused training."
https://www.deligence.com/,Programming,98,"Deligence Technologies is a technology solutions provider specializing in AI, web, and mobile app development, with a core company value of continuous learning in cutting-edge technologies."
https://www.technokaksha.com/,Programming,98,"The institution is an IT training center that exclusively offers and promotes technical courses such as Data Analytics, AI/ML, and Full Stack Development."
https://www.techquenchsolution.com/,Programming,95,"The company's core identity is a software development and IT solutions provider that also manufactures STEM/AI/Robotics kits, indicating a deep and foundational need for advanced programming skills."
https://infokey.in/,Programming,95,"The company's core identity is a software development firm building a diverse portfolio of technical products using AI and cloud services, which necessitates continuous upskilling in programming."
https://unstop.com/,Programming,95,"The website explicitly lists 'Hackathons' as a core offering, which are programming-centric events indicating a strong technology focus."
https://wingify.com/,Sales,95,"Wingify has the highest number of open positions in its global sales department, indicating a primary focus on expanding its market reach and driving revenue growth."
http://www.ceoitbox.com/,Sales,95,"This company is a B2B business coaching and consulting firm whose growth is entirely dependent on selling its services to other businesses, and they even offer specific coaching to master marketing and sales."
https://www.selloverseas.com/,Sales,100,"The company's entire business model is a B2B platform dedicated to helping businesses find international distributors, franchisees, and independent sales agents to expand their global sales."
https://www.dishahconsultants.com/sales-training-in-delhi,Sales,100,"This company is a corporate training consultancy that specializes entirely in sales, leadership, and business communication programs."
http://nsut.ac.in/,Programming,98,The institution is consistently described as a top-ranked university of technology and an engineering college with a primary focus on technical education and research.
http://dtu.ac.in/,Sales,95,"The target institution is the Delhi School of Management (DSM), a business school where sales is a highly relevant field of study."
http://www.bvcoend.ac.in/,Programming,100,"The institution is a dedicated College of Engineering with numerous technical departments, including Computer Science, IT, and AI/ML, and strong placements with major tech companies."
http://www.nitdelhi.ac.in/,Programming,98,"As a National Institute of Technology, the institution's departments, offered B.Tech/M.Tech degrees, and student clubs are overwhelmingly focused on engineering and computer science."
http://www.iiitd.ac.in/,Programming,99,"This institution is a highly-ranked, research-led university specializing in Information Technology, with degree programs and departments dedicated to Computer Science, Engineering, and Artificial Intelligence."
http://www.aiactr.ac.in/,Programming,98,"The institution is a dedicated engineering and technology university with a curriculum exclusively focused on Computer Science and Engineering disciplines like AI, Big Data, and IoT."
https://www.mait.ac.in/,Programming,100,"The institution is an engineering college with numerous technology-focused departments, and its distinguished alumni hold prominent software engineering and data science roles at top tech companies."
http://www.jmi.ac.in/,Programming,95,"The institution features a dedicated Faculty of Engineering and Technology, with specific departments for Computer Engineering, Computer Science, and various other engineering disciplines, indicating a strong focus on technical education."
https://adgips.ac.in/,Programming,95,"The institution is an engineering and technology college, making programming courses highly relevant for its core student body."
http://iitm.net.in/,Programming,95,"The institute's core offerings are heavily focused on technology, with degrees in B.Tech in Computer Science Engineering and Bachelor of Computer Applications."
http://kccitm.edu.in/,Programming,95,"The institution is an Institute of Technology and Management with an extensive list of B.Tech and M.Tech programs heavily focused on Computer Science, AI, and Data Science."
http://www.iitmjp.ac.in/,Programming,90,"The institute's mission is to train Information Technology professionals and Software Engineers, supported by its dedicated Department of Computer Science and Bachelor of Computer Applications (BCA) program."
http://www.bpitindia.ac.in/,Programming,98,"The institution is an Institute of Technology with a curriculum, training programs, and placement records heavily focused on engineering and programming roles at top tech companies."
https://www.itsengg.edu.in/,Programming,98,"The institution is an engineering college with a significant majority of its programs, faculty, and top placements dedicated to Computer Science and other technology fields."
